{
  "chapter_title": "售后服务与运行保障方案",
  "sections": [
    {
      "heading": "服务目标",
      "block_type": "introduction",
      "content": "本次售后服务的总目标是为采购人提供稳定、可靠、快速响应的超融合系统运行保障，确保医院业务系统7×24小时不间断高效运行。方案围绕设备全生命周期管理，聚焦故障预防、快速恢复和持续优化三条主线，将被动式维修转变为主动式运维。具体而言，我方承诺在保修期内实现故障修复时限逐级压缩，核心部件故障平均修复时间（MTTR）控制在招标最低时限以内，系统整体可用性维持在99.9%以上。同时，通过定期巡检和健康检查提前发现隐患，将非计划停机风险降至最低。整个服务过程遵循国家及行业信息安全标准，严格保护医疗数据安全，并以制度化监督机制保障每次服务的规范性和可追溯性。",
      "covered_score_item_ids": [],
      "covered_requirement_ids": [],
      "placeholder_ids": [],
      "section_id": "WC-005-01"
    },
    {
      "heading": "服务范围",
      "block_type": "technical_solution",
      "content": "本方案的服务范围覆盖本次采购的全部超融合节点、超融合互联交换机以及相关的系统软件与中间件，自设备通过最终验收并正式投入使用之日起进入保修期。在保修期内，我方提供全免费的原厂级技术支持与硬件维保，具体包括但不限于：硬件故障诊断与修复、远程技术支持、现场备件更换、系统软件补丁与版本升级、7×24小时电话及在线支持，以及每年不低于两次的现场巡检与系统健康评估。保修期结束后，我方继续提供终身维修服务，仅收取备件成本与合理人工费用，并终身提供免费的电话技术支持。对于超出保修期续保服务，我方将基于实际设备使用状态提供灵活的服务级别协议选项。此外，所有服务过程产生的技术文档、配置变更记录、巡检报告及维修工单将作为项目交付成果一并归档移交采购人，为日后的运维管理提供完整的数据基础。",
      "covered_score_item_ids": [],
      "covered_requirement_ids": [],
      "placeholder_ids": [],
      "section_id": "WC-005-02"
    },
    {
      "heading": "服务组织体系",
      "block_type": "organization_plan",
      "content": "",
      "covered_score_item_ids": [],
      "covered_requirement_ids": [],
      "placeholder_ids": [],
      "section_id": "WC-005-03"
    },
    {
      "heading": "服务机构与人员",
      "block_type": "organization_plan",
      "content": "",
      "covered_score_item_ids": [],
      "covered_requirement_ids": [
        "TR-003"
      ],
      "placeholder_ids": [],
      "section_id": "WC-005-04"
    },
    {
      "heading": "服务响应机制",
      "block_type": "service_commitment",
      "content": "我方郑重承诺，自最终验收合格之日起的整个保修期内，严格向采购人提供如下服务响应：- 7×24小时技术响应：提供多通道服务请求入口，服务请求及时受理并响应。- 24小时内维修工程师到达维修现场：自请求受理起计时，位于市内及周边指定区域的认证工程师携带常用备件及工具包，确保24小时内抵达医院机房现场，如遇特殊气象或交通管制，将通过高速铁路和预备车辆等措施保证时限。- 免费更换零配件：保修期内因自然故障导致的硬件、模块及功能性零部件均免费更换，更换所用的全部部件均为原厂全新件或同等规格备件，更换过程遵循原厂更换作业指导书，并在更换后完成不少于2小时的系统稳定性测试。- 保修期自验收合格之日起计算，保修期内所有响应和维修承诺不因设备使用时长而缩减。以上响应指标已集成至我方ITSM系统，系统自动监控各环节时效，任何可能超时的事件将自动升级至项目服务经理及分管副总经理，确保在时限内闭环。",
      "covered_score_item_ids": [],
      "covered_requirement_ids": [
        "TR-002"
      ],
      "placeholder_ids": [],
      "section_id": "WC-005-05"
    },
    {
      "heading": "故障处理流程",
      "block_type": "technical_solution",
      "content": "故障处理遵循“受理-诊断-修复-验证-闭环”的标准化流程，并与医院现有的IT运维流程无缝衔接。服务台接到故障报修后，首先与报修人确认故障现象、影响范围及业务紧急程度，据此确定故障级别（紧急、一般、轻度），并在10分钟内完成工单创建。一级事件如核心业务中断，立刻启动紧急预案，通知项目服务经理及制造商二线支持，并行进行远程诊断和准备现场备件。技术工程师通过带外管理网络或远程桌面进行初步诊断，定位到疑似板卡、内存、硬盘或软件配置问题时，同步准备替换部件和软件恢复方案。现场工程师到达后首先执行数据安全确认与备份（如需），再实施更换或修复操作，恢复后按照系统验收测试用例验证业务功能、存储性能及网络连通性，测试通过则请采购人代表签字确认。故障排除后记录故障分析信息，供后续查阅。所有流程均在ITSM系统中留痕，接受采购人随时在线查阅。对于同一部件重复故障或批量性隐患，系统将自动触发制造商质量分析流程并推动产品改进。",
      "covered_score_item_ids": [],
      "covered_requirement_ids": [],
      "placeholder_ids": [],
      "section_id": "WC-005-06"
    },
    {
      "heading": "保修与维修方案",
      "block_type": "requirement_response",
      "content": "我方完全响应招标文件TR-001条款，提供投标产品免费保修及终身维修的完整保障。具体的免费保修年限将在商务标书中予以明确，届时将满足或优于招标要求的最低5年基准（具体年限见{{placeholder_warranty_period}}）。在保修期内，所有因设备自身质量问题导致的硬件故障、软件缺陷及性能异常，均由我方承担全部维修、备件及人工费用，采购人无需支付任何额外费用。维修期间我方优先采用“先换后修”策略，即现场工程师携带合格备件直接替换故障单元，将停机时间压缩至最短，换下的故障件进入制造商维修流程，修复后经全检合格方可作为备件归库。保修期届满后，我方继续向采购人提供终身维修服务，仅按届时公示的零部件成本价格及合理工时费收取费用，且终身保留对本次采购设备的软件版本更新和电话技术支持。对于机房搬迁、设备扩容、系统优化等非故障性技术服务，我方也可根据采购人需要提供专项服务方案，价格另行协商。",
      "covered_score_item_ids": [],
      "covered_requirement_ids": [
        "TR-001"
      ],
      "placeholder_ids": [],
      "section_id": "WC-005-07"
    },
    {
      "heading": "备品备件保障",
      "block_type": "technical_solution",
      "content": "高效的备件供应是保证及时到场维修时限的关键。我方依托制造商在华北区的备件总库与我司本地服务分库，共同构成本项目的两级备件保障体系。针对本次采购的设备型号，依据设备配置清单经与采购人协商确定备件储备品种。本地服务分库确保上述常见部件常备库存，常规尺寸部件储备量不低于2套/种，以覆盖日常故障替换和计划性巡检发现的需要。对于机箱背板、交换网板等低故障率大型部件，由省级备件总库或制造商代管仓提供24小时内调配，通过安全专车直发医院现场。所有备件均张贴唯一编码进行全生命周期追踪，存放环境满足防静电、防潮、恒温要求，并实施月度盘点与定期加电测试，确保随时可用。库存数据与ITSM系统联动，当低于安全库存时自动向制造商的ERP系统触发补货指令，杜绝因备件缺失导致的延误。",
      "covered_score_item_ids": [],
      "covered_requirement_ids": [],
      "placeholder_ids": [],
      "section_id": "WC-005-08"
    },
    {
      "heading": "巡检与健康检查",
      "block_type": "technical_solution",
      "content": "为将被动维修转变为主动保障，我方在保修期内按合同约定的频次对全部在保设备进行深度现场巡检与健康检查，时间上结合医院业务低谷期协商确定。每次巡检由经制造商认证的资深工程师执行，内容涵盖：设备物理状态检查（指示灯、积尘、线缆连接、环境温湿度）、系统日志深度分析、超融合平台性能指标采集（CPU/内存/IOPS/带宽利用率、存储池均衡度、网络丢包与延迟）、以及固件与系统补丁版本审计。巡检工程师在现场利用便携式诊断终端完成各项测试，并实时记录发现异常。巡检结束后及时提交《系统运行健康评估报告》，包含检查数据、趋势分析、发现的问题及改进建议，并与往期报告进行纵向对比，直观展现系统运行态势。对于巡检中发现的潜在隐患（如硬盘SMART告警、电源模块负偏差等），我方主动发起免费维修工单，与采购人约定时间进行预防性更换，不计入保修事件次数，也不影响保修权益。",
      "covered_score_item_ids": [],
      "covered_requirement_ids": [],
      "placeholder_ids": [],
      "section_id": "WC-005-09"
    },
    {
      "heading": "服务质量监督",
      "block_type": "quality_assurance",
      "content": "为了确保所有服务承诺能够不折不扣落地，我方建立了多维度、可量化的服务质量监督机制，并将所有KPI向采购人透明展示。核心监督手段包括：- 服务级别协议（SLA）自动监控：ITSM平台内置SLA引擎，对服务响应、到场、修复、关闭四个节点的时间进行细粒度计时，任何即将超时的工单将向项目服务经理和管理层逐级推送告警。- 服务质量报告：按约定周期向采购人提交《售后服务月报》，内容包括事件统计（按级别、类型、设备、区域）、SLA达成率分析、备件消耗情况、巡检与变更记录，以及后续服务计划与风险评估。- 季度服务评审会：由项目服务经理牵头，医院信息科、双方相关管理层参加，回顾季度服务质量、讨论重大问题、优化下一阶段服务策略，并形成会议纪要以及行动项跟踪表。- 满意度调查：每次维修、巡检、升级服务完成后，服务台将自动推送电子满意度问卷（含响应速度、技术水平、服务态度、业务恢复效果等维度），结果量化后作为对一线工程师绩效考核的依据之一。- 投诉处理：设立投诉渠道，投诉事项及时响应并按流程出具处理意见和整改方案。所有投诉记录纳入供应商绩效评价，并作为后续服务优化的推动点。",
      "covered_score_item_ids": [],
      "covered_requirement_ids": [],
      "placeholder_ids": [],
      "section_id": "WC-005-10"
    },
    {
      "heading": "服务承诺",
      "block_type": "service_commitment",
      "content": "综上所述，我方向采购人做出以下明确的服务承诺，愿意将承诺内容作为合同附件受法律约束：1. 免费保修与终身维修：提供不低于招标规定的免费保修年限（具体年限见{{placeholder_warranty_period}}），保修期自最终验收合格之日开始计算保修期外提供终身维修，仅收取备件成本与合理人工费用。2. 保修期全免费：在保修期内因产品质量问题引发的所有维修、更换备件和人工费用均由我方承担，绝不向采购人收取任何费用。3. 7×24小时技术响应：24小时维修工程师到达现场，自保修期起至结束绝不降低响应标准。4. 备件保障：核心备件常备库存，确保24小时内替换，杜绝因备件等待造成的长时间业务中断。5. 巡检：根据采购人需要进行现场巡检并记录检查结果。6. 服务透明性：月度服务报告、季度评审会、实时事件工单进度，采购人可随时检核所有服务质量数据。7. 制造商服务机构：所投产品制造商服务机构情况（包括地址、联系方式及技术人员数量等）依据招标文件要求提供。以上承诺共同构成完整的服务承诺体系，如因我方原因未能履行，愿按合同约定承担违约责任与赔偿责任。",
      "covered_score_item_ids": [],
      "covered_requirement_ids": [
        "TR-001",
        "TR-002",
        "TR-003"
      ],
      "placeholder_ids": [],
      "section_id": "WC-005-11"
    }
  ],
  "claims": [
    {
      "text": "保修期内免费更换零配件，7×24小时技术响应，24小时内维修工程师到达维修现场。保修期自验收合格之日起计算。",
      "claim_type": "commitment_statement",
      "source_ids": [
        "TR-002"
      ],
      "evidence_ids": [],
      "human_review_required": false,
      "response_intent": "no_deviation",
      "evidence_status": "confirmed",
      "deviation_status": "no_deviation"
    },
    {
      "text": "我方承诺终身维修服务，保修期外仅收取备件成本和合理人工费用。",
      "claim_type": "commitment_statement",
      "source_ids": [
        "TR-001"
      ],
      "evidence_ids": [],
      "human_review_required": false,
      "response_intent": "no_deviation",
      "evidence_status": "pending",
      "deviation_status": "no_deviation"
    },
    {
      "text": "我方承诺每年至少两次深度现场巡检，并提交书面健康评估报告。",
      "claim_type": "commitment_statement",
      "source_ids": [],
      "evidence_ids": [],
      "human_review_required": false
    },
    {
      "text": "我方承诺本地服务分库常备核心备件，储备不低于2套/种，并联动ITSM实现自动补货。",
      "claim_type": "commitment_statement",
      "source_ids": [],
      "evidence_ids": [],
      "human_review_required": false
    }
  ],
  "placeholders_used": [],
  "score_items_covered": [],
  "requirements_covered": [
    "TR-001",
    "TR-002",
    "TR-003"
  ],
  "warnings": [
    "保修年限及制造商服务机构具体信息尚未确认，已在相应位置使用占位符，需在定稿前补充。",
    "本方案中的人员配置、备件储备数量、巡检频率等承诺基于方案设计，最终版本需以确认后的企业事实材料为准。"
  ],
  "generated_supporting_tables": []
}
