{
  "chapter_title": "实施部署方案",
  "sections": [
    {
      "heading": "实施总体规划",
      "block_type": "introduction",
      "content": "本项目实施部署方案围绕天津市第五中心医院超融合系统建设目标，严格按照招标文件要求，从项目建设技术方案、项目设计实施周期、人员架构三个核心维度展开，并细化涵盖安装部署、测试试运行、质量控制、项目验收、交付成果及风险控制与应急保障等完整实施内容。方案以标准化和规范化为实施方针，确保所有活动在合同约定的框架内高效推进。\n\n在商务响应层面，我方完全认同并响应招标文件第二部分招标项目要求中关于交货的条款：交货期按签订合同后30日内到货执行，安装完成按到货之日起10日内完成，交货地点为采购人指定地点，并随设备提供制造商完整的随机资料（含使用和维修手册等）。上述响应均为无偏离承诺，并构成本方案实施计划的基准约束。后续各节将逐一展开具体方案，形成可执行、可检查、可验收的完整闭环。",
      "covered_score_item_ids": [
        "SCORE-TR-022-R017"
      ],
      "covered_requirement_ids": [
        "TR-005",
        "TR-006",
        "TR-007",
        "TR-008",
        "TR-009",
        "TR-010",
        "TR-022"
      ],
      "placeholder_ids": [],
      "section_id": "WC-003-01"
    },
    {
      "heading": "项目建设技术方案",
      "block_type": "technical_solution",
      "content": "本项目的建设技术方案以超融合架构为基础，通过软件定义的方式整合计算、存储和网络资源，构建高性能、高可靠的虚拟化基础设施平台。方案统一规划超融合节点集群和超融合互联交换机，实现资源的弹性调度、在线扩展和智能运维，满足医院当前及未来业务系统对计算能力、存储容量及网络带宽的持续增长需求。架构设计遵循分层解耦、冗余容错的原则，任一节点或组件的故障均不会导致整体服务中断，确保核心业务的连续性。\n\n在具体部署策略上，超融合节点将采用多节点集群模式，通过超融合互联交换机构建无阻塞的数据交换平面，承载虚拟化层、存储集群网络及管理网络。系统将预装并配置主流的虚拟化平台，实现计算、存储虚拟化和网络虚拟化的统一管理，并提供图形化管理界面以简化日常运维。整体方案既保证了技术先进性，又兼顾了医院现有环境的兼容性和平滑过渡能力，为后续业务系统的迁移和上线奠定坚实的基础。",
      "covered_score_item_ids": [
        "SCORE-TR-022-R017"
      ],
      "covered_requirement_ids": [
        "TR-022"
      ],
      "placeholder_ids": [],
      "section_id": "WC-003-02"
    },
    {
      "heading": "项目设计实施周期",
      "block_type": "implementation_plan",
      "content": "本项目的实施周期严格遵循招标文件的时限要求进行规划與承诺。货到时间自签订合同之日起30日内完成，安装完成时间为货到之日起10日内。上述两个时间节点均以招标文件所明示的基准为准，我方对此无任何偏离。考虑到项目实施过程中可能存在的节假日、物流协调及现场环境准备等因素，我方将在合同生效后立即启动采购与物流流程，同步与采购人确认现场就绪条件，确保30日到货和10日安装的刚性约束能够稳步达成。\n\n实施总体周期被划分为到货前准备、设备到场与清点、安装部署、系统调试与试运行、验收交付五个阶段。各阶段紧密衔接，关键节点明确。到货前准备阶段将完成详细实施方案的细化、人员配置和现场勘查设备到场阶段执行开箱检验和上架连接安装阶段完成软件部署和初步配置调试与试运行阶段进行功能与性能测试最终进入验收并交付完整资料。每一阶段均设定明确的完成判据，并做好前置依赖管理，确保整个周期可控、可追踪。",
      "covered_score_item_ids": [
        "SCORE-TR-022-R017"
      ],
      "covered_requirement_ids": [
        "TR-005",
        "TR-006",
        "TR-007",
        "TR-022"
      ],
      "placeholder_ids": [],
      "section_id": "WC-003-03"
    },
    {
      "heading": "项目组织架构",
      "block_type": "organization_plan",
      "content": "{{PH-FIELD-PROJECT-MANAGER}}\n\n团队成员组成遵循专业分工、高效协作的原则，具体成员清单为{{PH-FIELD-PROJECT-TEAM}}。\n\n{{PH-FIELD-STAFFING-PLAN}}",
      "covered_score_item_ids": [
        "SCORE-TR-022-R017"
      ],
      "covered_requirement_ids": [
        "TR-022"
      ],
      "placeholder_ids": [
        "PH-FIELD-PROJECT-MANAGER",
        "PH-FIELD-PROJECT-TEAM",
        "PH-FIELD-STAFFING-PLAN"
      ],
      "section_id": "WC-003-04"
    },
    {
      "heading": "项目负责人及主要人员",
      "block_type": "personnel_detail",
      "content": "{{PH-FIELD-PROJECT-MANAGER}}\n\n具体执行团队的组成将依据项目技术需求和实施复杂度进行匹配，人员信息详见{{PH-FIELD-PROJECT-TEAM}}。\n\n{{PH-FIELD-STAFFING-PLAN}}",
      "covered_score_item_ids": [
        "SCORE-TR-022-R017"
      ],
      "covered_requirement_ids": [
        "TR-022"
      ],
      "placeholder_ids": [
        "PH-FIELD-PROJECT-MANAGER",
        "PH-FIELD-PROJECT-TEAM",
        "PH-FIELD-STAFFING-PLAN"
      ],
      "section_id": "WC-003-05"
    },
    {
      "heading": "安装部署",
      "block_type": "implementation_plan",
      "content": "安装部署是项目实施的关键物理实现环节，将在设备到货并完成开箱检验后立即开展。首先进行现场勘查与准备，核实电源、散热、机柜空间、网络端口等基础环境是否符合超融合节点和交换机的部署要求，并根据勘查结果形成《现场环境确认表》。随后进行硬件上架，将超融合节点设备安装至标准19英寸机柜，连接电源模块并固定超融合互联交换机同步上架并完成与各节点之间的物理连线，确保线缆标签清晰、走线规范。\n\n硬件安装完成后，进行软件部署。依次安装并配置服务器虚拟化层、存储虚拟化模块和网络虚拟化策略，并依据设计方案设置集群冗余、数据副本策略和故障转移规则。所有配置均实行双重验证，配置完成后生成《安装部署记录表》，记录设备序列号、固件版本、网络地址分配等关键信息，为后续测试和运维提供可靠基线。整个安装部署过程将遵循公司标准操作规程(SOP)，并接受现场监督。",
      "covered_score_item_ids": [
        "SCORE-TR-022-R017"
      ],
      "covered_requirement_ids": [
        "TR-022"
      ],
      "placeholder_ids": [],
      "section_id": "WC-003-06"
    },
    {
      "heading": "测试与试运行",
      "block_type": "implementation_plan",
      "content": "安装部署完成后进入系统测试阶段，测试活动按照“单元测试—集成测试—系统测试”的顺序逐级展开。单元测试验证单个节点的硬件自检、网络连通性和存储模块状态集成测试验证集群间数据同步、虚拟交换正常性和管理节点的高可用性系统测试将依据已确认的《测试方案》执行，覆盖功能测试、性能测试和可靠性测试，如模拟单点故障验证自动切换、IO压力测试及长时间空载运行等。所有测试结果均记录在案，并作为进入试运行的准入门槛。\n\n试运行阶段将在功能测试全部通过并达到预期后启动。试运行期间将实时监测系统的CPU使用率、内存占用、存储I/O、网络吞吐量及告警信息，运维人员每日巡检并填写《试运行日志》。对于试运行中发现的任何异常，立即启动问题排查与闭环处理流程。试运行的终止条件是连续运行达到稳定状态且无影响业务的关键故障。在此基础上，双方将签署《试运行通过确认书》，标志着系统具备正式上线条件。",
      "covered_score_item_ids": [
        "SCORE-TR-022-R017"
      ],
      "covered_requirement_ids": [
        "TR-022"
      ],
      "placeholder_ids": [],
      "section_id": "WC-003-07"
    },
    {
      "heading": "质量控制",
      "block_type": "quality_assurance",
      "content": "项目质量控制贯穿于供货、安装、测试及调试的全过程，将以公司质量管理体系（依据ISO9001标准建立）为基础，针对本项目特点定制专项质量控制计划。实施过程中设置多项质量控制点，包括：设备到货检验点（核对型号、数量及外观完好）、安装工艺检验点（线缆绑扎、标签规范、接地可靠）、系统配置基线检查点、功能/性能测试通过率检查点和资料完整性检查点。每一点均设有量化检查项、合格判据和不合格处理流程，检查结果经检查人签字确认后归入项目文档。\n\n若任一级质量控制点未通过，必须执行纠正措施后进行复检，直到满足标准要求，否则不得转入下一环节。所有不符合项将记录在《不符合项跟踪表》中，分析根本原因并纳入项目持续改进。通过这种“节点控制、逐级放行”的质量管理模式，确保最终交付系统完全符合合同及招投标技术规格的要求。",
      "covered_score_item_ids": [
        "SCORE-TR-022-R017"
      ],
      "covered_requirement_ids": [
        "TR-022"
      ],
      "placeholder_ids": [],
      "section_id": "WC-003-08"
    },
    {
      "heading": "项目验收",
      "block_type": "implementation_plan",
      "content": "项目验收将完全按照招标文件第二部分招标项目要求之（六）验收方法及标准执行。验收的依据为采购合同约定的各项技术、服务和安全标准，以及现行国家标准、行业标准和企业标准。验收过程接受采购人全程组织和监督，我方全力配合采购人开展出厂检验、到货检验、安装调试检验、配套服务检验等多重验收环节。若采购人决定邀请其他投标人或第三方机构参与验收，我方亦将无条件配合，并将第三方意见作为验收参考资料。\n\n验收程序包括：提交验收申请及完整的技术文档和过程记录，由采购人组建验收小组，召开验收会议，逐项核对设备配置、功能、性能和文档，现场可进行抽检验证。验收结束后将出具正式验收书，列明各项标准的履约情况和项目总体评价，并由双方共同签署。验收通过是项目完成的标志，同时也意味着履约责任的持续，我方仍将承担质保期内的所有义务。",
      "covered_score_item_ids": [
        "SCORE-TR-022-R017"
      ],
      "covered_requirement_ids": [
        "TR-010",
        "TR-022"
      ],
      "placeholder_ids": [],
      "section_id": "WC-003-09"
    },
    {
      "heading": "交付成果",
      "block_type": "other",
      "content": "依据招标文件第二部分（三）交货要求，我方在交货地点——采购人指定地点——将交付下列成果：\n\n1. 合同约定的全部超融合系统硬件设备，包括超融合节点和超融合互联交换机，设备交付时包装完好、配件齐全，并随附装箱清单和产品合格证2. 制造商提供的完整随机资料，包括完整的使用手册、维修手册、技术参数表和软件许可文件等3. 项目实施过程中形成的全套技术文档，涵盖《现场勘查报告》、《安装部署记录表》、《系统配置基线文件》、《测试方案》、《测试报告》、《试运行日志》、《验收书》及《交付资料清单》等。\n\n所有文档均提供纸质版及电子版，介质和份数与采购人协商确认，确保资料的系统性、完整性和可追溯性，为后续运维和扩展提供坚实的信息支撑。",
      "covered_score_item_ids": [
        "SCORE-TR-022-R017"
      ],
      "covered_requirement_ids": [
        "TR-008",
        "TR-009",
        "TR-022"
      ],
      "placeholder_ids": [],
      "section_id": "WC-003-10"
    },
    {
      "heading": "风险控制与应急保障",
      "block_type": "risk_control",
      "content": "本项目实施过程中，我方识别出以下主要风险并制定了相应的防范与应急措施：供货延误风险，可能影响整体进度现场环境不符风险，可能导致安装中断配置错误风险，可能影响系统稳定性以及人员变动风险，可能造成沟通断层。针对每一类风险，均制定了预防措施和应急响应预案，并明确责任人。\n\n预防措施包括：提前与供应商锁定库存并签订紧急供货协议，安排双重物流方案在合同签署后立即进行现场勘查并出具确认函关键配置前做备份核心人员任命实行双岗制。应急响应上，一旦发生风险事件，项目经理在30分钟内启动应急小组，评估影响并执行备选方案，同时将情况即时通报采购人。所有风险事件都记录在《风险登记册》中，事后进行复盘和措施优化，确保项目管理持续成熟。",
      "covered_score_item_ids": [
        "SCORE-TR-022-R017"
      ],
      "covered_requirement_ids": [
        "TR-022"
      ],
      "placeholder_ids": [],
      "section_id": "WC-003-11"
    }
  ],
  "claims": [
    {
      "text": "响应招标要求TR-005：交货期。",
      "claim_type": "tender_fact",
      "source_ids": [
        "TR-005"
      ],
      "evidence_ids": [],
      "human_review_required": false,
      "response_intent": "no_deviation",
      "evidence_status": "confirmed",
      "deviation_status": "no_deviation"
    },
    {
      "text": "响应招标要求TR-006：货到时间自签订合同之日起30日内。",
      "claim_type": "tender_fact",
      "source_ids": [
        "TR-006"
      ],
      "evidence_ids": [],
      "human_review_required": false,
      "response_intent": "no_deviation",
      "evidence_status": "confirmed",
      "deviation_status": "no_deviation",
      "tender_baseline": "30日",
      "offered_value": "30日",
      "comparison_direction": "upper_limit"
    },
    {
      "text": "响应招标要求TR-007：安装完成货到之日起10日内。",
      "claim_type": "tender_fact",
      "source_ids": [
        "TR-007"
      ],
      "evidence_ids": [],
      "human_review_required": false,
      "response_intent": "no_deviation",
      "evidence_status": "confirmed",
      "deviation_status": "no_deviation",
      "tender_baseline": "10日",
      "offered_value": "10日",
      "comparison_direction": "upper_limit"
    },
    {
      "text": "响应招标要求TR-008：交货地点为采购人指定地点。",
      "claim_type": "tender_fact",
      "source_ids": [
        "TR-008"
      ],
      "evidence_ids": [],
      "human_review_required": false,
      "response_intent": "no_deviation",
      "evidence_status": "confirmed",
      "deviation_status": "no_deviation"
    },
    {
      "text": "响应招标要求TR-009：提供制造商完整的随机资料，包括使用和维修手册等。",
      "claim_type": "tender_fact",
      "source_ids": [
        "TR-009"
      ],
      "evidence_ids": [],
      "human_review_required": false,
      "response_intent": "no_deviation",
      "evidence_status": "confirmed",
      "deviation_status": "no_deviation"
    },
    {
      "text": "响应招标要求TR-010：验收方法及标准，包括多重验收环节、第三方参与验收、出具验收书等，均无偏离。",
      "claim_type": "tender_fact",
      "source_ids": [
        "TR-010"
      ],
      "evidence_ids": [],
      "human_review_required": false,
      "response_intent": "no_deviation",
      "evidence_status": "confirmed",
      "deviation_status": "no_deviation"
    }
  ],
  "placeholders_used": [
    "PH-FIELD-PROJECT-MANAGER",
    "PH-FIELD-PROJECT-TEAM",
    "PH-FIELD-STAFFING-PLAN"
  ],
  "score_items_covered": [
    "SCORE-TR-022-R017"
  ],
  "requirements_covered": [
    "TR-005",
    "TR-006",
    "TR-007",
    "TR-008",
    "TR-009",
    "TR-010",
    "TR-022"
  ],
  "warnings": [
    "项目组织架构和人员部分因缺少已确认的项目负责人、项目团队及详细人员安排，采用占位符，最终版本需由人工确认并补充。",
    "实施周期承诺为招标文件规定的最长时限，属于无偏离响应，投标人若有更优周期需另行确认并更新。",
    "所有产品功能、品牌、型号等信息未在实施部署方案中确认，待技术应答表中由授权人填写。"
  ],
  "generated_supporting_tables": []
}
