{
  "chapter_title": "培训方案",
  "sections": [
    {
      "heading": "培训目标",
      "block_type": "technical_solution",
      "content": "确保系统上线后能够稳定、高效地运行，同时降低对原厂服务的依赖性，提升医院信息部门自助运维水平。围绕“现场技术培训”这一基本要求，我方将结合项目整体实施计划，在系统安装调试的关键窗口期开展系统性、分层次的培训活动。\n\n培训目标将按内容层次拆分为三个层面：第一层面聚焦节点管理、存储策略配置、网络互联调试及系统扩容操作等基础运维技能；第二层面聚焦监控平台告警处置、虚拟机生命周期管理、备份恢复等日常操作技能；第三层面聚焦前端业务与超融合平台交互的原理及常见问题的初步定位方法。上述目标均对应具体的考核标准，在培训实施完成后通过理论与实操相结合的方式逐项校验",
      "covered_score_item_ids": [
        "SCORE-TR-022-R018"
      ],
      "covered_requirement_ids": [
        "TR-022"
      ],
      "placeholder_ids": [],
      "section_id": "WC-004-01"
    },
    {
      "heading": "培训对象",
      "block_type": "technical_solution",
      "content": "根据医疗信息化系统的运维特点，本次培训的对象将覆盖与超融合平台日常运行密切相关的三类岗位人群。培训对象分为三类：第一类侧重整体规划与安全管控，第二类侧重日常巡检与告警处理，第三类侧重业务配合与状态核实。\n\n上述分类并非固定不变，在培训需求确认阶段，我方将协同采购人信息部门负责人，最终确定各批次学员名单与技能起点，并据此微调课程内容深度，避免出现“内容过深听不懂、内容过浅没效果”的两极分化问题。对于不同对象的培训侧重点和授课方式将在培训内容与培训形式小节中进一步细化。",
      "covered_score_item_ids": [
        "SCORE-TR-022-R018"
      ],
      "covered_requirement_ids": [
        "TR-022"
      ],
      "placeholder_ids": [],
      "section_id": "WC-004-02"
    },
    {
      "heading": "培训内容",
      "block_type": "technical_solution",
      "content": "培训内容设计遵循“从整体认知到专项深入，从原理理解到动手操作”的递进逻辑，确保参训人员在系统性掌握知识的同时，形成实际解决问题的能力。内容体系分为基础理论模块、管理操作模块和应急处理模块三大部分。\n\n基础理论模块涵盖超融合系统的基本架构与核心组件，包括计算虚拟化、分布式存储、网络逻辑拓扑、互联交换机工作原理等重点讲解本项目实际采用的节点部署架构、数据冗余策略以及性能分层机制，帮助管理员理解系统行为背后的设计意图。\n\n管理操作模块围绕日常运维场景展开，具体包括基于管理平台的资源创建与分配、存储策略制定与优化、集群健康状态巡检、用户权限配置以及备份恢复全流程操作。每一环节均安排在真实设备上进行操作演练，讲师将现场演示标准操作并指导学员逐一练习，直至达到独立完成为止。\n\n应急处理模块聚焦常见的报警与故障场景，例如节点宕机、网络中断、磁盘故障以及性能突降等，通过模拟故障注入的方式，训练学员快速定位问题、执行既定处理流程并与原厂技术支持有效沟通的能力。所有教学内容将根据培训对象的岗位职责进行裁剪，确保管理员获得全面技能，而操作员专注于高频操作和标准处置流程。",
      "covered_score_item_ids": [
        "SCORE-TR-022-R018"
      ],
      "covered_requirement_ids": [
        "TR-022"
      ],
      "placeholder_ids": [],
      "section_id": "WC-004-03"
    },
    {
      "heading": "培训形式",
      "block_type": "technical_solution",
      "content": "本次培训采用“集中课堂讲授+实验室环境上机+生产现场跟随”三种形式有机结合的方式，力求将理论知识、操作技能与真实运维体验融为一体。集中课堂讲授主要用于基础理论和系统架构的普及性授课，采用演示文稿、拓扑图板和原理动画等形式辅助讲解，帮助学员在短时间内建立系统全局概念。\n\n实验室环境上机是培训的核心环节，我方将在项目实施现场搭建独立的实训环境或利用部署完成且未承载业务的早期系统作为实操平台。学员在讲师指导下完成虚拟机创建、存储策略配置、快照与克隆、巡检脚本执行等操作任务，每个任务均有明确的检查点和完成标准。生产现场跟随则安排在系统上线后的早期运维阶段，在真实环境中共同执行巡检、告警处理和工单闭环，巩固培训内容，实现“扶上马、送一程”的效果。\n\n以上三种形式的具体时长和衔接节点，将在合同签订后根据项目总体进度与采购人协商确定，确保与系统部署、初验及试运行等关键里程碑形成闭环配合。",
      "covered_score_item_ids": [
        "SCORE-TR-022-R018"
      ],
      "covered_requirement_ids": [
        "TR-022"
      ],
      "placeholder_ids": [],
      "section_id": "WC-004-04"
    },
    {
      "heading": "培训师资",
      "block_type": "technical_solution",
      "content": "培训效果在很大程度上取决于讲师的技术深度和教学能力，因此我方对培训师资选派制定了严格的内部标准。所有培训讲师均从我司技术交付团队中选拔，每位讲师须具备超融合产品的技术交付经验，并至少完整参与过两个以上同类项目的实施或售后工作，能够熟练处理各类常见部署与故障场景。\n\n在表达能力方面，讲师人选须经过内部试讲评估，确保能够清晰、有条理地讲解复杂技术概念，并能耐心指导不同基础的学员完成上机操作。针对本次项目，我方将组建由主讲师和助理讲师构成的培训小组，主讲师负责核心课程的设计与讲解，助理讲师重点负责上机环节的一对一指导及实操解答，确保实操环节每位学员都能获得充分的关注与辅导。具体讲师名单及资质背景将在合同签订后交付师资简历，供采购人审核确认。",
      "covered_score_item_ids": [
        "SCORE-TR-022-R018"
      ],
      "covered_requirement_ids": [
        "TR-022"
      ],
      "placeholder_ids": [],
      "section_id": "WC-004-05"
    },
    {
      "heading": "培训时间与地点",
      "block_type": "implementation_plan",
      "content": "培训时间的选取将严格遵守招标要求，保证为现场技术培训，并与系统实施进度相耦合。培训主体将安排在系统环境具备操作条件之后、试运行阶段之前进行。该时间窗口内系统环境已趋于稳定，相关功能均已具备操作条件，是开展实操培训的最佳时机。在此之前，可结合到货开箱、上架安装等环节，穿插进行预先的理论讲授，使学员提前建立认知框架。\n\n培训地点设在采购人指定的项目现场，利用本项目建成的超融合系统和互联交换机作为教学环境，不另设远程或第三方培训场地。如采购人现场具备独立的培训教室或会议室，可用于集中理论授课上机环节则直接在部署的生产或实训节点上进行。最终培训日程、每批次具体时间以及场地使用安排，将在合同生效后由我方项目经理与采购人指定负责人共同编制培训实施计划并签字确认。",
      "covered_score_item_ids": [
        "SCORE-TR-022-R018"
      ],
      "covered_requirement_ids": [
        "TR-022"
      ],
      "placeholder_ids": [],
      "section_id": "WC-004-06"
    },
    {
      "heading": "培训计划",
      "block_type": "implementation_plan",
      "content": "为将招标文件要求的“提供现场技术培训”转化为可执行、可检查的培训活动，我方制定了分阶段培训计划，将培训嵌入项目实施的整体进程之中，避免培训与实施脱节。培训整体分为三个阶段：第一阶段为“理论导入”期，安排在设备到货与上架期间，由主讲师利用等待安装窗口向采购人相关人员介绍超融合基础概念及本项目的架构设计，使学员提前了解即将接触的系统环境。第二阶段为“安装跟学”期，安排在设备上架、布线、初始化配置期间，采购人技术人员在现场跟随我方实施工程师，通过观摩与辅助操作理解实际部署流程，重点掌握上架规范、线缆连接与初始配置访问方法。第三阶段为“集中面授与实操”期，安排在系统完成网络和存储配置、进入试运行前，开展为期数天的集中培训，涵盖管理操作、日常运维和应急处理全部课程，并以考核收尾。\n\n具体的各阶段培训内容与对象对应关系见下表。下表中的时长和起止日期将在项目启动后，根据采购人业务窗口期和节假日安排协商确定，我方承诺在正式培训开始前不少于两周递交详细培训计划表，经采购人书面确认后实施。\n\n表1 超融合系统培训阶段计划表\n\n| 培训阶段 | 主要内容 | 参训对象 | 时长安排 | 地点 |\n|----------|----------|----------|----------|------|\n| 理论导入 | 超融合架构概论、硬件认知、项目实施计划讲解 | 信息部门管理员、科室联络员 | 待协商 | 采购人现场会议室 |\n| 安装跟学 | 硬件上架、线缆连接、首次加电及初始化配置 | 信息部门管理员 | 随工开展 | 采购人机房 |\n| 集中面授与实操 | 管理平台操作、存储与网络配置、巡检与备份、故障模拟、考核 | 信息部门管理员与运维人员 | 待协商 | 采购人现场实训区 |\n\n上述三阶段计划的执行过程由我方项目经理负责跟踪，每一阶段结束后均需形成培训签到记录和阶段性效果评估，纳入项目资料统一归档，确保培训全过程留痕、可追溯。",
      "covered_score_item_ids": [
        "SCORE-TR-022-R018"
      ],
      "covered_requirement_ids": [
        "TR-004",
        "TR-022"
      ],
      "placeholder_ids": [],
      "section_id": "WC-004-07"
    },
    {
      "heading": "培训考核",
      "block_type": "quality_assurance",
      "content": "培训考核是检验培训质量与学员掌握程度的直接手段，也是培训方案闭环的关键环节。我方将采用“理论考核+实操考核”双维评价体系，两者缺一不可。理论考核采用闭卷或机考形式，重点考查超融合系统架构原理、关键组件功能、巡检要点及应急预案等知识点。实操考核则在真实系统上命题，要求学员在规定时间内完成虚拟机创建与迁移、存储策略调整、告警排查与处理等真实任务，评委由我方主讲师与采购人信息部门负责人共同担任，依据标准操作评分表打分。\n\n考核结果划分为合格与不合格两种。合格者由我司颁发本项目培训完成证明文件，证明其已具备独立操作和维护超融合系统的能力。不合格者可在集中培训结束后的两周内申请一次免费补训与补考，补训针对其薄弱环节进行强化指导，补考仍不合格的，将报告采购人并协助制定后续能力提升计划。全部考核记录、试卷及评分表单随项目资料交付采购人存档。",
      "covered_score_item_ids": [
        "SCORE-TR-022-R018"
      ],
      "covered_requirement_ids": [
        "TR-022"
      ],
      "placeholder_ids": [],
      "section_id": "WC-004-08"
    },
    {
      "heading": "培训资料",
      "block_type": "technical_solution",
      "content": "为保障教学质量并便于学员课后复习和日常运维查阅，我方将为本项目定制编写配套培训资料，并成套交付给采购人。资料包括：一是《超融合系统操作手册》，该手册以本项目实际部署环境为基础，按功能模块逐一编写操作步骤和界面截图，确保图文对应、即学即用二是《常见故障处理指南》，汇总超融合系统运行中可能出现的告警和异常表现，详细列出原因分析、排查路径和处置措施三是讲师授课演示文稿的电子版和对应的课堂练习题目，供学员复练。\n\n所有培训资料在培训开始前提交采购人审核，确保内容准确且无歧义。资料交付介质包括纸质版一套和可编辑电子版一份，便于采购人后续根据系统变更自行修订。在质保期内如系统进行版本升级或功能变更，我方将同步更新相关培训资料并交付采购人。",
      "covered_score_item_ids": [
        "SCORE-TR-022-R018"
      ],
      "covered_requirement_ids": [
        "TR-022"
      ],
      "placeholder_ids": [],
      "section_id": "WC-004-09"
    },
    {
      "heading": "培训效果保障",
      "block_type": "quality_assurance",
      "content": "培训完成并不代表能力建设的终点，我方将通过一系列效果保障机制确保培训成果能够长期巩固并转化为实际运维能力。首先，在培训结束后的一周内，向每位学员发放匿名满意度调查问卷，涵盖课程内容设计、讲师水平、实操安排、资料质量等维度，并设置开放性意见栏。项目经理将综合问卷结果在一周内输出培训效果评估报告，识别共性问题并提出改进措施，该报告同时抄送采购人。\n\n其次，在系统试运行期间，我方驻场工程师将重点观察参训运维人员的实际操作情况，对反复出现误操作或仍缺乏信心的学员进行一对一补充辅导，并将常见薄弱环节记录为运营知识点，纳入资料修订范围。此外，在日常技术支持过程中，将结合培训内容进行引导式解答，以此强化知识回忆与应用能力。如采购人评估后认为整体培训效果未达到本方案所设定的目标，我方承诺在不增加额外费用的情况下安排一次集中补充培训。",
      "covered_score_item_ids": [
        "SCORE-TR-022-R018"
      ],
      "covered_requirement_ids": [
        "TR-022"
      ],
      "placeholder_ids": [],
      "section_id": "WC-004-10"
    }
  ],
  "claims": [
    {
      "text": "我方将完全响应招标文件要求，提供现场技术培训。",
      "claim_type": "commitment_statement",
      "source_ids": [
        "TR-004"
      ],
      "evidence_ids": [],
      "human_review_required": false,
      "response_intent": "no_deviation",
      "evidence_status": "confirmed",
      "deviation_status": "no_deviation"
    },
    {
      "text": "培训方案覆盖培训目标、对象、内容、形式、师资、时间地点、计划、考核、资料和效果保障，全面响应培训方案评价要求。",
      "claim_type": "score_coverage_statement",
      "source_ids": [
        "TR-022"
      ],
      "evidence_ids": [],
      "human_review_required": false,
      "evidence_status": "pending",
      "deviation_status": "no_deviation"
    },
    {
      "text": "培训考核包括理论考试和实操考核，合格者颁发培训完成证明文件。",
      "claim_type": "proposal_statement",
      "source_ids": [],
      "evidence_ids": [],
      "human_review_required": false,
      "evidence_status": "pending",
      "deviation_status": "no_deviation"
    },
    {
      "text": "我方将提供《超融合系统操作手册》、《常见故障处理指南》及授课演示文稿等定制化培训资料。",
      "claim_type": "commitment_statement",
      "source_ids": [],
      "evidence_ids": [],
      "human_review_required": true,
      "evidence_status": "missing",
      "deviation_status": "no_deviation"
    },
    {
      "text": "培训效果未达目标时，我方承诺不增加额外费用安排一次集中补充培训。",
      "claim_type": "commitment_statement",
      "source_ids": [],
      "evidence_ids": [],
      "human_review_required": true,
      "evidence_status": "pending",
      "deviation_status": "no_deviation",
      "additional_obligation": "一次免费集中补充培训"
    }
  ],
  "placeholders_used": [],
  "score_items_covered": [
    "SCORE-TR-022-R018"
  ],
  "requirements_covered": [
    "TR-004",
    "TR-022"
  ],
  "warnings": [],
  "generated_supporting_tables": [
    {
      "section_id": "WC-004-07",
      "title": "超融合系统培训阶段计划表",
      "purpose": "将培训计划中的三阶段内容、对象、时长和地点进行横向对比展示，便于采购人一目了然地掌握培训整体安排。",
      "why_table_is_better_than_prose": "三阶段横向比较涉及多个维度的信息，表格可以一次性清晰呈现阶段与内容、对象、时长的对应关系，比纯文字描述更易阅读和比对。"
    }
  ]
}
