{
  "chapter_title": "实施部署方案",
  "sections": [
    {
      "heading": "实施总体规划",
      "block_type": "introduction",
      "content": "为确保本次超融合系统采购项目的顺利实施，我公司依据招标文件的要求，结合同类项目的成功交付经验，制定了系统性的实施总体规划。本规划以合同生效为起点，覆盖设备供货、安装部署、系统测试、试运行及正式验收的全生命周期，旨在实现安全、高效、合规的项目交付。\n\n实施工作将遵循“按时交付、质量可控、风险防范、充分配合”的原则。我方承诺在签订合同后30日内完成全部货物的到货，并在货到之日起10日内完成所有设备的安装与初步调试。交货地点为采购人指定地点，我公司将负责全部运输、卸货及现场就位工作。\n\n项目实施分为五个主要阶段：第一阶段为项目启动与计划阶段，双方确认实施环境、接口关系及沟通机制；第二阶段为供货与开箱验收阶段，按清单完成到货并配合采购人进行开箱检验；第三阶段为安装部署阶段，进行设备上架、接线、基础配置与互联互通测试；第四阶段为系统测试与试运行阶段，按测试大纲完成功能验证和稳定性考验；第五阶段为正式验收与交付阶段，整理过程资料并签署验收书。各阶段均设置明确的质量控制点和退出判据，确保前一阶段成果达标后启动后续工作。对于实施过程中的变更与异常，将启动专项评估与审批流程，并在项目协调会上同步处理方案。\n\n我公司将组建具备医院信息化项目实施经验的专项团队，设置项目经理、技术实施组及质量保障组，明确各岗位职责与汇报关系。具体组织架构和主要人员信息将后续提供。",
      "covered_score_item_ids": [
        "SCORE-TR-022-R017"
      ],
      "covered_requirement_ids": [
        "TR-005",
        "TR-006",
        "TR-007",
        "TR-008",
        "TR-022"
      ],
      "placeholder_ids": [],
      "section_id": "WC-003-01"
    },
    {
      "heading": "项目建设技术方案",
      "block_type": "technical_solution",
      "content": "本次项目建设核心为超融合系统的部署，涉及的软硬件包括超融合节点、超融合互联交换机以及相关的管理平台。我公司提供的建设技术方案将围绕采购人现有的信息化环境，在不影响医院正常业务的前提下，完成新系统的搭建和联调。\n\n方案的整体技术路线是在采购人指定机房区域，部署超融合节点集群，并通过超融合互联交换机实现节点间的高速数据交换与存储网络互通。所有超融合节点将采用冗余网络连接，确保链路级的高可用。系统采用分布式存储与虚拟化融合架构，通过统一管理平台实现计算、存储、网络资源的池化与集中调度。部署过程中将根据设备配置参数，完成主机初始化、集群组建、软件版本核对、统一监控配置等操作。\n\n本次建设的实施总原则是：先环境勘察后硬件进场，先单机检验后集群搭建，先连通性测试后业务验证。在物理环境满足条件后，我公司将按照方案确定的拓扑图完成设备物理安装、标签粘贴、线缆整理与绑扎。安装完成后进行上电自检，确认各节点工作状态正常后，通过管理平台创建集群，配置分布式存储策略、虚拟机网络模板及高可用策略。最后导入采购人认可的基础运营环境并进行为期数日的试运行观测。\n\n所有技术实施活动将以招标要求的时限为工期边界，确保在合同约定时间内高质量交付。具体的详细配置、策略参数及整合方案将在深化设计阶段与采购人充分沟通后形成《项目详细设计说明书》予以确认。",
      "covered_score_item_ids": [
        "SCORE-TR-022-R017"
      ],
      "covered_requirement_ids": [
        "TR-005",
        "TR-006",
        "TR-007",
        "TR-022"
      ],
      "placeholder_ids": [],
      "section_id": "WC-003-02"
    },
    {
      "heading": "项目设计实施周期",
      "block_type": "implementation_plan",
      "content": "本合同项目的设计与实施周期严格遵循招标文件的交货及安装要求。我公司承诺：货到时间为自签订合同之日起30日内，安装完成时间为货到之日起10日内。整体实施周期不超过40个日历日。\n\n为兑现上述承诺，我公司在项目启动后将立即启动供货准备与物流调度，确保设备在合同生效后30日内抵达采购人指定地点。安装阶段将组派充足的技术人员驻场作业，采取并行施工与分班推进相结合的方式，在10日内完成所有超融合节点、互联交换机及其配套线缆的上架安装、网络调试和系统联调工作。\n\n进度控制将通过项目进度计划表进行管理，以合同生效日为T0基准，明确以下关键里程碑：\n\nT+5日：完成项目启动会议，确认实施环境与用户需求；\nT+25日：设备从总库发出，物流在途跟踪；\nT+30日：设备到货，完成开箱检验；\nT+35日：完成全部设备上架、布线及基础配置；\nT+40日：完成集群组建、系统调试、连通性验证和试运行启动。\n\n上述计划预留了合理的并行作业与缓冲时间，并将在项目启动阶段与采购人确认具体工作日历后细化至《项目进度计划书》。若出现不可抗力或采购人原因导致的延迟，将及时启动变更流程，协商调整工期，确保双方利益。",
      "covered_score_item_ids": [
        "SCORE-TR-022-R017"
      ],
      "covered_requirement_ids": [
        "TR-005",
        "TR-006",
        "TR-007"
      ],
      "placeholder_ids": [],
      "section_id": "WC-003-03"
    },
    {
      "heading": "项目组织架构",
      "block_type": "placeholder_section",
      "content": "",
      "covered_score_item_ids": [
        "SCORE-TR-022-R017"
      ],
      "covered_requirement_ids": [
        "TR-022"
      ],
      "placeholder_ids": [],
      "section_id": "WC-003-04"
    },
    {
      "heading": "项目负责人及主要人员",
      "block_type": "placeholder_section",
      "content": "",
      "covered_score_item_ids": [
        "SCORE-TR-022-R017"
      ],
      "covered_requirement_ids": [
        "TR-022"
      ],
      "placeholder_ids": [],
      "section_id": "WC-003-05"
    },
    {
      "heading": "安装部署",
      "block_type": "implementation_plan",
      "content": "安装部署是项目从硬件到货向系统成型的核心环节。我公司将严格按照“先检查、后安装，先物理、后逻辑，单节点通过后方入集群”的原则，在货到10日内高质量完成全部安装任务。\n\n设备抵达采购人指定地点后，首先联合采购人代表进行开箱外观检验，核对装箱单与合同清单的一致性，确认无物理损坏和配件遗漏，形成《设备开箱验收单》。随后按照施工图纸和机房环境要求，将超融合节点固定在标准机柜中，部署超融合互联交换机，完成电源线和网线的布放。所有线缆将使用清晰标签标识，走线整齐捆扎，符合机房施工规范。\n\n设备上电后，依次进行单机硬件自检、固件版本核对与必要升级、管理口IP配置及管理网络连通性测试。确认所有节点状态正常后，在管理平台上创建集群，配置分布式存储网络、管理网络和业务网络。接着配置高可用策略、虚拟机网络策略及存储池。完成配置后，导入基础管理员账户并执行集群健康检查，确保无报错信息。\n\n安装过程中，所有操作均记录在《安装配置记录表》中，配置参数经技术负责人审核后方可生效。安装完毕后，进行系统连通性验证和基本功能测试，为后续的全面测试与试运行奠定基础。",
      "covered_score_item_ids": [
        "SCORE-TR-022-R017"
      ],
      "covered_requirement_ids": [
        "TR-007",
        "TR-022"
      ],
      "placeholder_ids": [],
      "section_id": "WC-003-06"
    },
    {
      "heading": "测试与试运行",
      "block_type": "quality_assurance",
      "content": "系统测试与试运行是验证整体建设成果的关键过程，其目的在于确保超融合系统的功能、性能、稳定性满足招标要求及采购人的使用期望。测试阶段将遵循“先功能、后性能、先单机、后集群、先基础、后业务”的顺序进行。\n\n测试工作将依据我公司拟定的《系统测试大纲》开展，该大纲将在测试开始前提交采购人审核确认。测试内容主要包括：硬件健康检测、集群管理功能测试（节点增删、数据迁移、故障模拟等）、存储性能测试（IOPS、吞吐量、延迟）、虚拟机生命周期管理功能测试、网络连通性与高可用切换测试。所有测试用例均预定义预期结果，测试结果记录于《测试记录表》中。对于测试中发现的问题，将执行缺陷管理流程，经过修复、回归验证后关闭。\n\n测试全部通过后，系统进入试运行期。试运行期间，系统承载非关键业务或测试业务连续运行，由监控平台实时监测运行状态。我方技术人员将驻场保障，记录每日运行状态，处理异常事件。试运行的退出条件为连续一定日数无重大告警且系统指标稳定达标（具体要求将在测试大纲中商定）。试运行结束后，出具《试运行报告》作为验收依据。",
      "covered_score_item_ids": [
        "SCORE-TR-022-R017"
      ],
      "covered_requirement_ids": [
        "TR-022"
      ],
      "placeholder_ids": [],
      "section_id": "WC-003-07"
    },
    {
      "heading": "质量控制",
      "block_type": "quality_assurance",
      "content": "质量控制贯穿于项目实施全过程，我公司将依托标准化的项目管理体系，设置阶段质量控制点，确保每个环节的输出符合要求。\n\n在项目启动阶段，质量控制的重点是实施方案的评审。我公司将组织内部技术委员会对施工方案、测试计划、人员配置等进行技术评审，并提交采购人确认。实施阶段的控制点包括：设备到货签收前的开箱检验，安装完成后的物理规范检查（走线、标签、散热等），配置完成后的参数核查，以及各阶段的文件签认。只有上述检查全部合格，且相关方签署阶段性确认文件后，项目才可进入下一阶段。\n\n针对测试与试运行阶段，质量控制以测试用例通过率和试运行设备的稳定性为核心，由质量保障人员对测试过程进行独立抽查，并复核测试数据的真实性。所有发现的不符合项均需记录在《不符合项报告》中，跟踪处理直至关闭。验收阶段则将带领采购人逐项核对合同和技术承诺的履约情况。\n\n若质量控制点未获通过，将立即启动整改流程，明确整改措施、责任人与完成时限，并在整改完成后重新申请检查，直至满足质量要求。",
      "covered_score_item_ids": [
        "SCORE-TR-022-R017"
      ],
      "covered_requirement_ids": [
        "TR-022"
      ],
      "placeholder_ids": [],
      "section_id": "WC-003-08"
    },
    {
      "heading": "项目验收",
      "block_type": "requirement_response",
      "content": "项目验收将严格按照采购合同的约定以及现行国家标准、行业标准、企业标准执行。我公司充分尊重并响应招标文件（TR-010）所述的验收方法及标准，包括采购人有权根据需要设置出厂检验、到货检验、安装调试检验、配套服务检验等多重验收环节。必要时，采购人有权邀请参加本项目的其他投标人或者第三方机构参与验收，其意见作为验收书的参考资料一并存档。\n\n我公司将在各验收环节主动提供所需的技术文件、测试记录和品质证明。例如，到货检验时提供《设备开箱验收单》及出厂合格证；安装调试检验时提供《安装配置记录》和连通性测试报告；试运行结束后提供《试运行报告》。最终验收环节，双方共同出具验收书，列明各项标准的验收情况及项目总体评价，并由双方共同签署。\n\n我公司将指定专人全程协同验收工作，并对采购人提出的质询提供技术澄清。任何验收中暴露的问题，我公司承诺在协商的时限内完成整改，并申请重新验收，直至获得采购人确认。",
      "covered_score_item_ids": [
        "SCORE-TR-022-R017"
      ],
      "covered_requirement_ids": [
        "TR-010",
        "TR-022"
      ],
      "placeholder_ids": [],
      "section_id": "WC-003-09"
    },
    {
      "heading": "交付成果",
      "block_type": "requirement_response",
      "content": "本项目交付成果分为实物交付和资料交付两大类。\n\n实物交付：所有超融合节点、超融合互联交换机以及相关的线缆、配件等合同约定的设备，将一次性交付至采购人指定地点。交付时提供完整的装箱清单和货物合格证明。\n\n资料交付：按招标要求提供制造商完整的随机资料，包括但不限于完整的使用手册、维修手册、产品技术规格书、出厂检测报告等。此外，我公司将额外提供在项目实施过程中形成的技术文档，包括《项目详细设计说明书》《安装配置记录》《系统测试报告》《试运行报告》《竣工图纸》以及各类过程记录。所有资料均交付一套纸质版（加盖公司印章）及一套电子版（光盘或U盘），确保文档的完整性和可追溯性。\n\n最终的交付物清单将在项目启动阶段与采购人协商确认，并以《交付物清单》的形式作为合同补充文件，确保双方对交付内容和形式无歧义。",
      "covered_score_item_ids": [
        "SCORE-TR-022-R017"
      ],
      "covered_requirement_ids": [
        "TR-008",
        "TR-009"
      ],
      "placeholder_ids": [],
      "section_id": "WC-003-10"
    },
    {
      "heading": "风险控制与应急保障",
      "block_type": "risk_control",
      "content": "为确保项目顺利实施，我公司制定了针对性的风险控制与应急保障方案，主要覆盖供货、安装、技术及管理四个维度。\n\n供货风险：针对设备生产周期或物流延迟的可能性，我公司将提前启动备货流程，与制造商签订优先供货协议，并安排库存资源。同时，密切跟踪物流状态，预留一定的缓冲期。若发生不可抗力导致延迟，将第一时间通报采购人，协商应急方案，如紧急调拨替代设备以保障工期。\n\n安装风险：可能出现机房环境不满足或意外事件影响施工。我公司将在项目启动阶段派遣技术工程师进行现场勘察，提前识别电源、散热、承重等环境问题并协助采购人解决。安装期间，由项目经理现场督战，配置足够的备用配件和工具，以应对突发硬件故障。\n\n技术风险：包括系统兼容性、配置错误等。防范措施是严格执行技术方案评审制度，所有配置脚本经两人复核，并在测试环境中先行验证。如遇技术难题，可启动公司总部的二线技术支持团队远程或现场支援。\n\n管理风险：主要指沟通不畅或进度失控。我公司将在项目启动会上建立明确的沟通机制，每周提交项目周报，定期召开项目协调会，及时暴露问题并做出决策。\n\n所有风险处理均遵循“识别—评估—响应—关闭”的闭环流程，并在项目风险登记册中追踪至关闭。",
      "covered_score_item_ids": [
        "SCORE-TR-022-R017"
      ],
      "covered_requirement_ids": [
        "TR-022"
      ],
      "placeholder_ids": [],
      "section_id": "WC-003-11"
    }
  ],
  "claims": [
    {
      "text": "我公司承诺在签订合同后30日内完成全部货物的到货，并在货到之日起10日内完成所有设备的安装与初步调试。",
      "claim_type": "commitment_statement",
      "source_ids": [
        "TR-006",
        "TR-007"
      ],
      "evidence_ids": [],
      "human_review_required": true,
      "response_intent": "no_deviation",
      "evidence_status": "confirmed",
      "deviation_status": "no_deviation",
      "tender_baseline": "货到30日内，安装10日内",
      "offered_value": "货到30日内，安装10日内",
      "comparison_direction": "fixed"
    },
    {
      "text": "交货地点为采购人指定地点。",
      "claim_type": "commitment_statement",
      "source_ids": [
        "TR-008"
      ],
      "evidence_ids": [],
      "human_review_required": false,
      "response_intent": "no_deviation",
      "evidence_status": "confirmed",
      "deviation_status": "no_deviation"
    },
    {
      "text": "提供制造商完整的随机资料，包括完整的使用和维修手册等。",
      "claim_type": "commitment_statement",
      "source_ids": [
        "TR-009"
      ],
      "evidence_ids": [],
      "human_review_required": false,
      "response_intent": "no_deviation",
      "evidence_status": "confirmed",
      "deviation_status": "no_deviation"
    },
    {
      "text": "项目验收遵循招标文件TR-010的验收方法及标准，接受多环节验收及第三方参与。",
      "claim_type": "commitment_statement",
      "source_ids": [
        "TR-010"
      ],
      "evidence_ids": [],
      "human_review_required": false,
      "response_intent": "no_deviation",
      "evidence_status": "confirmed",
      "deviation_status": "no_deviation"
    }
  ],
  "placeholders_used": [],
  "score_items_covered": [
    "SCORE-TR-022-R017"
  ],
  "requirements_covered": [
    "TR-005",
    "TR-006",
    "TR-007",
    "TR-008",
    "TR-009",
    "TR-010",
    "TR-022"
  ],
  "warnings": [
    "缺少项目负责人及主要团队成员的具体资料，人员相关章节（项目组织架构、项目负责人及主要人员）仅以占位说明填充，待确认后补充。",
    "产品具体配置和功能能力未确认，相关技术描述基于通用实施方法，未涉及具体产品参数。",
    "试运行时长等数字指标尚未协商确认，已在测试与试运行章节中表述为“连续一定日数”，待项目启动后明确。"
  ],
  "generated_supporting_tables": []
}
