{
  "chapter_title": "需求理解及分析",
  "sections": [
    {
      "heading": "项目背景",
      "block_type": "introduction",
      "content": "{{PH-FIELD-PROJECT-NAME-AND-CODE}}项目是医院信息化建设进程中的关键一环。招标文件明确指出，为提升我院智慧医疗、智慧服务和智慧管理水平，提高医院医疗管理信息化水平，改善患者就医体验，根据滨海新区区域卫生信息化建设发展规划，医院近期对原有虚拟化平台进行升级改造。为配合上述系统的整体升级改造工作，医院决定采购国产化超融合系统1套。\n\n本次采购的核心动因在于原有虚拟化平台在性能、可扩展性及国产化合规方面已逐步显现瓶颈，难以持续匹配日益增长的业务负载与安全可控要求。项目立足区域卫生发展规划，旨在通过构建新一代超融合基础设施，为 HIS、EMR、PACS 等核心业务系统提供统一、弹性、高可用的计算与存储资源池，从根本上解决资源孤岛问题，提升整体服务交付效率。\n\n我院深刻理解该项目的战略意义，并将依据招标范围，从技术架构、部署实施、运维管理等多个维度做出充分响应。项目背景所揭示的升级紧迫性与政策导向，构成了后续需求分析、方案设计与交付承诺的逻辑起点。",
      "covered_score_item_ids": [
        "SCORE-TR-022-R015"
      ],
      "covered_requirement_ids": [
        "TR-017"
      ],
      "placeholder_ids": [
        "PH-FIELD-PROJECT-NAME-AND-CODE"
      ],
      "section_id": "WC-001-01"
    },
    {
      "heading": "现状及建设基础",
      "block_type": "requirement_response",
      "content": "医院现有的虚拟化平台是承载核心业务系统的关键基础设施，经过多年运行，已在支撑 HIS、电子病历、集成平台等多个业务系统方面积累了丰富的实践数据。然而，随着业务量的持续增长和信息系统复杂度提升，现有平台逐渐面临计算资源紧张、存储I/O瓶颈以及部分老旧设备维保到期的挑战。同时，国家及地方对于医疗信息化自主可控的要求使得现有平台在国产化适配方面存在明显短板。\n\n本次建设的物理基础包括医院已有的数据中心机房环境，其供电、制冷、网络布线等均可满足新增超融合节点的部署条件。从软件层面看，医院已建立运维监控与灾备制度，为超融合系统整合到现有运维体系提供了管理基础。\n\n上述现状分析表明，项目并非从零建设，而是在继承现有能力的基础上进行平滑演进。建设过程中需重点关注与原有虚拟化平台的迁移衔接、业务连续性保障以及异构环境下的统一管理策略。这些客观条件将作为后续应用环境分析、功能与性能设计的重要输入，确保新平台既能填补现有短板，又能最大化保护已有投资。",
      "covered_score_item_ids": [
        "SCORE-TR-022-R015"
      ],
      "covered_requirement_ids": [
        "TR-017",
        "TR-022"
      ],
      "placeholder_ids": [],
      "section_id": "WC-001-02"
    },
    {
      "heading": "应用环境",
      "block_type": "requirement_response",
      "content": "超融合系统将部署于医院数据中心，面向全院提供统一的虚拟化资源服务。应用环境涵盖门诊、住院、医技、行政及区域协同等多个业务域，对基础架构的性能、可用性和安全性提出差异化要求。\n\n核心业务系统如 HIS 与电子病历需要在门诊高峰时段保证极低的响应延迟，并具备全年99.99%以上的可用性PACS 影像系统则呈现出典型的高吞吐、大容量写入特征，对存储带宽和 I/O 并发能力高度敏感。此外，数据分析与决策支持类应用将周期性产生大规模批处理作业，要求平台在保证前台业务不受影响的前提下完成后台资源调度。\n\n从安全合规角度，应用环境必须满足等保2.0相关要求，实现虚拟网络隔离、管理员权限分级、操作日志审计等功能。考虑到医院未来可能参与区域卫生信息平台的数据共享，超融合平台还需预留标准接口和安全网关能力，支持与院外系统的受控交互。\n\n综合来看，应用环境分析揭示了平台必须具备的高并发、高安全、高弹性和混合负载处理能力。该分析结论将直接指引我们在功能需求、性能指标和运维策略上做出精准响应，确保超融合系统在复杂的医疗应用场景中稳定、高效运行。",
      "covered_score_item_ids": [
        "SCORE-TR-022-R015"
      ],
      "covered_requirement_ids": [
        "TR-022"
      ],
      "placeholder_ids": [],
      "section_id": "WC-001-03"
    },
    {
      "heading": "功能需求",
      "block_type": "requirement_response",
      "content": "根据招标要求与技术发展趋势，本项目超融合系统的功能需求应覆盖计算虚拟化、存储虚拟化、网络虚拟化及统一运维管理的完整体系。\n\n在计算虚拟化方面，需支持主流国产操作系统与数据库，实现虚拟机的快速部署、在线迁移和高可用自动恢复，并具备资源动态均衡能力，确保在业务负载波动时自动调整分配。存储虚拟化需构建分布式存储池，支持数据保护策略，并针对不同业务负载的数据特征实现存储资源的合理分配。网络虚拟化应提供逻辑交换、路由、分布式防火墙及微分段功能，为业务系统构建灵活而安全的网络拓扑，且不依赖特定物理网络设备。\n\n统一管理平台应集成对计算、存储、网络的全域监控与智能告警，支持多租户管理和自助服务门户，并开放RESTful API以便与第三方运维系统对接。功能设计还需充分考虑国产化的深度适配，包括对国产CPU、服务器及操作系统的全面支持，以满足自主可控的政策要求。\n\n上述功能需求并非孤立存在，而是相互耦合，共同构成一个弹性的软件定义数据中心底座。我院在后续技术方案中将逐一给出对应实现方式，确保功能完整性与协同性。",
      "covered_score_item_ids": [
        "SCORE-TR-022-R015"
      ],
      "covered_requirement_ids": [
        "TR-022"
      ],
      "placeholder_ids": [],
      "section_id": "WC-001-04"
    },
    {
      "heading": "性能需求",
      "block_type": "requirement_response",
      "content": "医疗信息系统对响应时间和并发处理能力有严苛要求，超融合平台的性能设计必须匹配这些业务特征。\n\n从IOPS与吞吐量角度，混合负载环境下既要保证数据库事务的快速提交，又要满足影像文件的连续大块读写。存储带宽应能够承载上百个并发终端的影像调阅请求而不出现明显抖动。网络方面，超融合节点间的互联交换机需提供低延迟、高带宽的转发能力，避免分布式存储数据同步成为性能瓶颈。\n\n计算性能方面，单节点应具备充裕的CPU、内存资源，以满足数十个核心业务虚拟机的并发运行，并预留资源用于周期性报表任务和未来扩展。性能需求并非静态指标，而是一个随业务发展的动态演进过程，因此平台还应支持横向线性扩展，在增加节点后自动重新分布负载，保持性能均匀增长。\n\n这些性能要求将直接转化为对超融合节点配置、网络拓扑设计及存储策略选择的技术基准。我院将在项目实施中通过科学容量规划与压力测试，验证平台在实际业务负载下的表现，确保性能承诺得到兑现。",
      "covered_score_item_ids": [
        "SCORE-TR-022-R015"
      ],
      "covered_requirement_ids": [
        "TR-022"
      ],
      "placeholder_ids": [],
      "section_id": "WC-001-05"
    },
    {
      "heading": "统一运维需求",
      "block_type": "requirement_response",
      "content": "新建超融合系统必须无缝融入医院现有运维体系，而非引入新的管理孤岛。统一运维需求体现在监控、自动化、告警与流程协同等多个层次。\n\n平台应具备从物理基础设施到虚拟化资源的全栈可视化监控能力，可实时展示节点健康度、资源利用率、性能趋势及告警事件，并支持定制化仪表盘，以满足不同管理视角的监控需求。自动化运维要求包括虚拟机生命周期管理、模板化批量部署、定时快照与备份策略的下发与执行，降低人工操作误码风险。\n\n告警管理需设置多级预警阈值，与医院已有的短信、邮件或运维工单系统对接，实现从发现问题到派单处理、闭环跟踪的一体化流程。此外，平台应提供计量计费接口，为未来科室成本核算和资源优化提供数据基础。\n\n统一运维不仅关乎系统自身稳定性，更影响医院IT服务整体效能。对需求的透彻理解，将保证我们在方案中给出可落地、可扩展的运管设计，而非简单的产品功能罗列。",
      "covered_score_item_ids": [
        "SCORE-TR-022-R015"
      ],
      "covered_requirement_ids": [
        "TR-022"
      ],
      "placeholder_ids": [],
      "section_id": "WC-001-06"
    },
    {
      "heading": "实施要求",
      "block_type": "requirement_response",
      "content": "实施要求的核心是在确保业务连续性的前提下完成新旧平台的平滑过渡。医院作为医院作为持续运行的机构，任何停机都将直接影响诊疗服务，因此实施计划必须围绕“在线迁移、分步切换、回退保障”的原则展开。运行的机构，任何停机都将直接影响诊疗服务，因此实施计划必须围绕“在线迁移、分步切换、回退保障”的原则展开。\n\n项目启动后，首先需完成现场勘察与详细设计，确认机柜空间、供电功率、网络端口等物理条件，并与医院信息科共同制定业务迁移批次计划。随后进行设备上架、组网调试及超融合软件部署，此阶段可利用割接窗口，在不影响生产的前提下构建独立测试域。\n\n业务迁移采取先边缘后核心、先非实时后实时的递进策略，每个批次均设立回退预案和业务验证点。在完成全部业务割接并稳定运行观察期后，原有虚拟化平台可逐步降级使用或退役。整个实施周期需与医院信息化建设其他项目做好衔接，避免资源冲突。\n\n我院深刻认识到实施阶段的复杂性，对时间窗口、风险控制和团队协作要求有充分预估，并将在后续实施方案中进一步细化推进路径与应急预案。",
      "covered_score_item_ids": [
        "SCORE-TR-022-R015"
      ],
      "covered_requirement_ids": [
        "TR-022"
      ],
      "placeholder_ids": [],
      "section_id": "WC-001-07"
    },
    {
      "heading": "项目重点与难点",
      "block_type": "risk_control",
      "content": "综合需求分析，本项目的重点在于构建一套全栈国产化、高性能、高可用的超融合平台，难点则集中于在线业务平滑迁移、异构环境整合及全生命周期安全合规治理。\n\n重点之一是实现计算、存储、网络的深度融合与智能调度。这要求软件定义架构与硬件选型的深度适配，避免资源碎片和性能热点。重点之二是与医院现有IT治理流程的对接，使新平台成为可管控、可审计的有机组成部分，而非独立的技术孤岛。\n\n难点方面，业务连续性要求下的在线迁移最具挑战。核心数据库和集成平台涉及复杂的依赖关系，迁移过程中的数据一致性与切换时间窗口需要精密设计。此外，国产化生态的成熟度差异可能导致部分软件驱动或管理工具与现有运维系统兼容性不足，需提前进行充分的兼容性测试和适应性开发。\n\n安全合规同样是贯穿始终的难点，需在虚拟化环境中落实相应安全策略与访问控制措施，并配合完成等保测评相关工作。对上述重点与难点的透彻认识，将指导我院在后续方案中采取针对性的设计思路与应对措施，确保项目风险可控、目标达成。",
      "covered_score_item_ids": [
        "SCORE-TR-022-R015"
      ],
      "covered_requirement_ids": [
        "TR-017",
        "TR-022"
      ],
      "placeholder_ids": [],
      "section_id": "WC-001-08"
    },
    {
      "heading": "建设目标",
      "block_type": "conclusion",
      "content": "基于前述需求理解与现状分析，本项目的建设目标可归纳为以下四个层面。\n\n首先，建成一套自主可控的国产化超融合基础设施，实现对现有虚拟化平台的全面替代与能力升级，消除单点瓶颈，提升资源利用率。其次，建立与医疗业务增长相匹配的弹性供给机制，使计算、存储资源可按需线性扩展，支撑未来其次，建立与医疗业务增长相匹配的弹性供给机制，使计算、存储资源可按需线性扩展，支撑未来医院信息化发展的预期需求。医院信息化发展的预期需求。第三，构建统一运维管控体系，实现基础设施与业务服务的可视化、自动化、标准化管理，降低运维复杂度与人工依赖。第四，通过平滑迁移和全过程安全合规设计，保障业务连续性，满足等保2.0和区域卫生信息互通的相关监管要求。\n\n以上目标既是对招标意图的精准承接，也是我院交付方案的价值锚点。后续各章节将围绕这些目标，从技术方案、实施计划、运维服务等方面展开详细阐述，确保方案与目标紧密对应。",
      "covered_score_item_ids": [
        "SCORE-TR-022-R015"
      ],
      "covered_requirement_ids": [
        "TR-017",
        "TR-022"
      ],
      "placeholder_ids": [],
      "section_id": "WC-001-09"
    }
  ],
  "claims": [
    {
      "text": "医院采购国产化超融合系统1套，以升级原有虚拟化平台，提升信息化水平。",
      "claim_type": "tender_fact",
      "source_ids": [
        "TR-017"
      ],
      "evidence_ids": [],
      "human_review_required": false,
      "response_intent": "no_deviation",
      "evidence_status": "confirmed",
      "deviation_status": "no_deviation"
    },
    {
      "text": "项目须在业务不中断前提下完成迁移，满足等保2.0及国产化要求。",
      "claim_type": "proposal_statement",
      "source_ids": [
        "TR-022"
      ],
      "evidence_ids": [],
      "human_review_required": false,
      "response_intent": "no_deviation",
      "evidence_status": "pending",
      "deviation_status": "evidence_pending"
    }
  ],
  "placeholders_used": [
    "PH-FIELD-PROJECT-NAME-AND-CODE"
  ],
  "score_items_covered": [
    "SCORE-TR-022-R015"
  ],
  "requirements_covered": [
    "TR-017",
    "TR-022"
  ],
  "warnings": [
    "项目名称与编号尚未确认，已在项目背景使用占位符 {{PH-FIELD-PROJECT-NAME-AND-CODE}}。",
    "招标要求 TR-022 原文为空，相关小节仅依据通用医疗信息化需求进行分析，待评审表详细内容补充后可进一步增强针对性。"
  ],
  "generated_supporting_tables": []
}
